{
  "$schema": "https://lafs.dev/schemas/v1/envelope.schema.json",
  "_meta": {
    "specVersion": "1.0.0",
    "schemaVersion": "1.0.0",
    "timestamp": "2026-02-13T00:00:00Z",
    "operation": "example.listOffset",
    "requestId": "req_offset_01",
    "transport": "http",
    "strict": true,
    "mvi": "standard",
    "contextVersion": 1
  },
  "success": true,
  "result": {
    "items": [
      { "id": "o1", "title": "Offset Item 1" }
    ]
  },
  "page": {
    "mode": "offset",
    "limit": 25,
    "offset": 0,
    "hasMore": false,
    "total": 1
  }
}
